{
  "$schema": "http://json-schema.org/draft-07/schema#",
  "type": "object",
  "title": "DockStacks",
  "description": "Defines the structure and validation rules for app templates in the DockStacks Store.",
  "properties": {
    "name": {
      "type": "string",
      "description": "The name of the stack or template.",
      "example": "my-stack"
    },
    "required_env_vars": {
      "type": "array",
      "items": {
        "type": "string",
        "description": "Environment variable names that need to be customized."
      },
      "description": "List of environment variables that require user input."
    },
    "services": {
      "type": "object",
      "additionalProperties": {
        "type": "object",
        "properties": {
          "image": {
            "type": "string",
            "description": "Docker image for the service.",
            "example": "nginx:latest"
          },
          "ports": {
            "type": "array",
            "items": {
              "type": "string",
              "description": "Port mappings (e.g., 80:80)."
            }
          },
          "environment": {
            "type": "object",
            "additionalProperties": {
              "type": "string",
              "description": "Environment variable key-value pairs."
            }
          },
          "volumes": {
            "type": "array",
            "items": {
              "type": "string",
              "description": "Volume mappings (e.g., /host:/container)."
            }
          },
          "deploy": {
            "type": "object",
            "description": "Docker Swarm deployment configuration.",
            "properties": {
              "replicas": {
                "type": "integer",
                "description": "Number of replicas."
              },
              "update_config": {
                "type": "object",
                "properties": {
                  "parallelism": {
                    "type": "integer",
                    "description": "Number of containers to update at a time."
                  },
                  "delay": {
                    "type": "string",
                    "description": "Delay between updates."
                  }
                }
              },
              "restart_policy": {
                "type": "object",
                "properties": {
                  "condition": {
                    "type": "string",
                    "description": "Restart condition (e.g., on-failure)."
                  },
                  "max_attempts": {
                    "type": "integer",
                    "description": "Maximum number of restart attempts."
                  }
                }
              }
            }
          }
        },
        "required": ["image"]
      },
      "description": "Defines the services in the stack."
    },
    "networks": {
      "type": "object",
      "additionalProperties": {
        "type": "object",
        "properties": {
          "driver": {
            "type": "string",
            "description": "Network driver (e.g., bridge, overlay)."
          },
          "driver_opts": {
            "type": "object",
            "additionalProperties": {
              "type": "string",
              "description": "Options for the network driver."
            }
          },
          "attachable": {
            "type": "boolean",
            "description": "Allow containers to attach to this network."
          }
        }
      },
      "description": "Defines custom networks for the stack."
    }
  },
  "required": ["name", "services"]
}
