{
  "$schema": "https://its4nik.github.io/DockStacks/schema.json",
  "required_env_vars": [],
  "name": "Uptime Kuma",
  "services": {
    "uptime-kuma": {
      "restart": "always",
      "ports": ["3001:3001"],
      "volumes": ["uptime-kuma:/app/data"],
      "container_name": "uptime-kuma",
      "image": "louislam/uptime-kuma"
    }
  },
  "networks": {}
}
