{
  "$schema": "https://its4nik.github.io/DockStacks/schema.json",
  "required_env_vars": [],
  "name": "Nextcloud All in One",
  "services": {
    "all-in-one": {
      "init": true,
      "container_name": "nextcloud-aio-mastercontainer",
      "restart": "always",
      "ports": ["80:80", "8080:8080", "8443:8443"],
      "volumes": [
        "nextcloud_aio_mastercontainer:/mnt/docker-aio-config",
        "/var/run/docker.sock:/var/run/docker.sock:ro"
      ],
      "image": "nextcloud/all-in-one:latest"
    }
  },
  "networks": {}
}
